{
  "controls": [
    {
      "action": "audit",
      "id": "ctrl-62",
      "result": "r-62",
      "target_exec": "run-62",
      "timing": "after_observed_execution"
    }
  ],
  "design_ir_version": "1.0",
  "executions": [
    {
      "id": "run-62",
      "input": "task-62",
      "program": "AgentRun"
    }
  ],
  "observations": [
    {
      "id": "obs-62",
      "observer": "Supervisor",
      "result": "r-62",
      "target_exec": "run-62"
    }
  ],
  "semantic_evidence": [
    {
      "claim": "Structured fixture; prose is context only.",
      "source": "v4-corpus"
    }
  ],
  "uncertain": []
}
