{
  "controls": [],
  "design_ir_version": "1.0",
  "executions": [
    {
      "id": "run-71",
      "input": "task-71",
      "program": "AgentRun"
    }
  ],
  "observations": [],
  "semantic_evidence": [
    {
      "claim": "Ordinary local loop or progress counter; no halting prediction result is modeled.",
      "source": "v4-corpus"
    }
  ],
  "uncertain": []
}
