{
  "controls": [
    {
      "action": "change_strategy",
      "id": "ctrl-18",
      "result": "r-18",
      "target_exec": "run-18",
      "timing": "during_observed_execution"
    }
  ],
  "design_ir_version": "1.0",
  "executions": [
    {
      "id": "run-18",
      "input": "task-18",
      "program": "AgentRun"
    }
  ],
  "observations": [
    {
      "id": "obs-18",
      "observer": "Supervisor",
      "result": "r-18",
      "target_exec": "run-18"
    }
  ],
  "semantic_evidence": [
    {
      "claim": "Structured fixture; prose is context only.",
      "source": "v4-corpus"
    }
  ],
  "uncertain": []
}
