{
  "controls": [
    {
      "action": "change_route",
      "id": "ctrl-1",
      "result": "r-1",
      "target_exec": "run-1",
      "timing": "during_observed_execution"
    }
  ],
  "design_ir_version": "1.0",
  "executions": [
    {
      "id": "run-1",
      "input": "task-25",
      "program": "AgentRun"
    }
  ],
  "observations": [
    {
      "id": "obs-1",
      "observer": "Evaluator",
      "result": "r-1",
      "target_exec": "run-1"
    }
  ],
  "semantic_evidence": [
    {
      "claim": "Structured expected DesignIR, not script-parsed prose.",
      "source": "fixture"
    }
  ],
  "uncertain": []
}
