{
  "controls": [
    {
      "action": "decide_next",
      "consumer": "Orchestrator",
      "id": "ctrl-73",
      "result": "r-73",
      "timing": "external_controller"
    }
  ],
  "design_ir_version": "1.0",
  "executions": [
    {
      "id": "run-73",
      "input": "task-73",
      "program": "AgentRun"
    }
  ],
  "observations": [
    {
      "id": "obs-73",
      "observer": "Supervisor",
      "result": "r-73",
      "target_exec": "run-73"
    }
  ],
  "semantic_evidence": [
    {
      "claim": "Structured fixture; prose is context only.",
      "source": "v4-corpus"
    }
  ],
  "uncertain": []
}