{
  "controls": [
    {
      "action": "change_strategy",
      "id": "ctrl-95",
      "result": "r-95",
      "target_exec": "run-95",
      "timing": "unknown"
    }
  ],
  "design_ir_version": "1.0",
  "executions": [
    {
      "id": "run-95",
      "input": "task-95",
      "program": "AgentRun"
    }
  ],
  "observations": [
    {
      "id": "obs-95",
      "observer": "Supervisor",
      "result": "r-95",
      "target_exec": "run-95"
    }
  ],
  "semantic_evidence": [
    {
      "claim": "Structured fixture; prose is context only.",
      "source": "v4-corpus"
    }
  ],
  "uncertain": [
    {
      "field": "controls[0].timing",
      "reason": "Consumer timing is not specified."
    }
  ]
}
