{
  "controls": [
    {
      "action": "schedule_retry",
      "id": "ctrl-68",
      "result": "r-68",
      "target_exec": "run-68-next",
      "timing": "future_execution"
    }
  ],
  "design_ir_version": "1.0",
  "executions": [
    {
      "id": "run-68",
      "input": "task-68",
      "program": "AgentRun"
    },
    {
      "id": "run-68-next",
      "input": "task-68-retry",
      "program": "AgentRun"
    }
  ],
  "observations": [
    {
      "id": "obs-68",
      "observer": "Supervisor",
      "result": "r-68",
      "target_exec": "run-68"
    }
  ],
  "semantic_evidence": [
    {
      "claim": "Structured fixture; prose is context only.",
      "source": "v4-corpus"
    }
  ],
  "uncertain": []
}
